title,image,description
"A Ajaccio, lancement du chantier de la centrale à la biomasse, attendu depuis vingt ans",https://img.lemde.fr/2024/11/22/0/0/3309/2206/110/73/60/0/ecca8e3_5322264-01-06.jpg,"Ce nouvel équipement, dont la mise en service progressive est programmée pour la fin de 2027, fournira le cinquième de la consommation annuelle insulaire."
Sécheresse : quand les fissures d’une maison apparaissent deux ans après la publication de l’arrêté de catastrophe naturelle,https://img.lemde.fr/2023/04/17/0/0/3000/2000/110/73/60/0/0265484_1681719509366-immobilier-01.jpg,Les nouveaux propriétaires protestent contre la prescription que leur oppose l’assureur.
"Le Rassemblement national remporte la municipale partielle à Rognac, dans les Bouches-du-Rhône",https://img.lemde.fr/2024/11/24/1/0/4198/2798/110/73/60/0/de11c67_1732492629491-maxnewsspecialtwo055470.jpg,"La commune, minée par la gestion de l’équipe sortante, est la première à basculer à l’extrême droite dans le département depuis 1997."
"A Venise, les habitants de Mestre se mobilisent contre le trafic de drogue et la corruption",https://img.lemde.fr/2024/11/19/640/0/1000/666/110/73/60/0/40c5748_359348-3396084.jpg,"A quelques kilomètres de la cité lacustre, la localité de Mestre est en proie à la pauvreté et à l’insécurité. Des habitants dénoncent l’inaction des autorités et multiplient les initiatives pour recréer du lien."
"La France buissonnière : des toiles de maîtres sur les façades de commerces fermés à Neuvy-sur-Barangeon, dans le Cher",https://img.lemde.fr/2024/11/20/168/0/4032/2688/110/73/60/0/ca4a3bc_1732088638063-img-9037.jpg,"A défaut de retenir les commerces, la maire de Neuvy-sur-Barangeon, dans le Cher, a fait installer des reproductions de chefs-d’œuvre de la peinture pour embellir les vitrines des magasins désaffectés."
"Une ville, des envies, cinq possibilités : Libourne",https://img.lemde.fr/2024/11/13/0/0/3543/2362/110/73/60/0/61b66a3_1731494133447-quais-libourne-depuis-l-eau-jeanmichellesaux.jpg,"Libourne, bastide prospère au XIIIᵉ siècle, a su garder son charme médiéval. Elle offre aussi de belles échappées à vélo à travers vignes ou sur les quais aménagés."
"« Malgré un cadre fiscal moins favorable, la location de courte durée restera plus lucrative que la location longue durée dans les zones touristiques »",https://img.lemde.fr/2024/11/07/1/0/4000/2666/110/73/60/0/356cd27_2024-11-07t210401z-1597498371-rc2iss92l1jv-rtrmadp-3-airbnb-results.JPG,"L’économiste Mehdi Farajallah doute, dans une tribune au « Monde », que la réduction des avantages fiscaux prévue par la loi de finances convaincra les propriétaires de renoncer à louer par le biais des plateformes comme Airbnb."
"A Sète, le marché immobilier reste dynamique",https://img.lemde.fr/2024/11/19/0/0/5200/3466/110/73/60/0/dea5c61_1732031385213-pns-773008000-1.jpg,"Les prix de l’immobilier ont légèrement baissé dans cette ville de l’Hérault, mais l’accès au marché demeure difficile pour les primo-accédants."
"Chengdu, une oasis de liberté dans l’empire du Milieu",https://img.lemde.fr/2024/11/18/0/0/1500/1000/110/73/60/0/d444251_358978-3397006.jpg,"La capitale de la province du Sichuan est réputée pour être la ville la plus cool de Chine. Mégapole prospère qui s’étire à l’ouest, loin du pouvoir central, elle attire la jeunesse créative et offre un espace à la communauté LGBT. Une liberté précaire, alors que le président Xi Jinping imprime un tournant autoritaire au pays."
De plus en plus d’entreprises remplacent la voiture de fonction par le vélo,https://img.lemde.fr/2024/10/11/0/1181/3543/2362/110/73/60/0/ad1f7c5_1728639504166-69721.jpg,"Le nombre de « vélotafeurs » est croissant, 800 000 personnes allaient à leur travail à vélo en 2021, selon la Fédération française des usagers de la bicyclette. Nouveaux aménagements et carotte fiscale poussent des chefs d’entreprise à commander des flottes de vélos pour leurs salariés."
"Logement : « Nos villes, trop chères, deviennent des lieux inaccessibles aux travailleurs et aux étudiants »",https://img.lemde.fr/2023/06/14/0/0/5568/3712/110/73/60/0/b4ed0d9_5538623-01-06.jpg,"Face à la flambée des prix de la pierre, un collectif d’élus de métropoles françaises et européennes préconise, dans une tribune au « Monde », l’accès à des prêts garantis pour financer des programmes immobiliers."
"Au cœur des villes, le défi de l’adaptation des végétaux",https://img.lemde.fr/2024/11/16/0/8/4272/2848/110/73/60/0/f8b6838_1731749668993-bios-2501716.jpg,"« La vie cachée des plantes ». Une équipe française a mesuré les changements morphologiques de quatre plantes herbacées poussant dans la ville de Strasbourg, confrontées aux îlots de chaleur urbains, à la densité des bâtiments ou aux tontes répétées. Et constaté que certaines de ces espèces, dans certaines limites, peuvent s’adapter."
Michel Barnier tente d’apaiser la colère des maires,https://img.lemde.fr/2024/11/21/0/0/1500/1000/110/73/60/0/9c2a1e3_1732205242366-cbir5880.jpg,"Le premier ministre a promis « plus de liberté » pour agir et de laisser les élus adapter les règles selon les réalités de leur territoire, jeudi, devant le congrès de l’Association des maires de France."
Le dossier néo-calédonien sous la pression des maires,https://img.lemde.fr/2024/11/21/0/0/1279/853/110/73/60/0/cf8f31f_1732210453162-cbir5667.jpeg,L’Association des maires de France a offert de la visibilité à plusieurs élus néo-calédoniens non indépendantistes venus lancer un appel à la solidarité nationale à Paris.
"La mort de Jacques Labro, inventeur de l’architecture d’Avoriaz",https://img.lemde.fr/2024/11/20/28/0/683/455/110/73/60/0/8c58e40_1732135751214-adf0f57e-e959-446e-8ad0-b6de2019fb31.jpeg,"Au début des années 1960, le jeune architecte avait imaginé, à mille lieues des « usines à ski » qui fleurissaient alors dans les Alpes, une station d’un genre nouveau, sans voiture. Il est mort le 11 novembre à 89 ans."
"Entre Emmanuel Macron et les maires, une histoire de rendez-vous manqués",https://img.lemde.fr/2024/11/21/0/0/1500/1000/110/73/60/0/8102527_1732184262692-cbir5521.jpg,"Le chef de l’Etat, en déplacement en Amérique latine, fait l’impasse sur le congrès des maires cette année. Une absence symbolique d’une incompréhension mutuelle qui n’a cessé de se développer depuis 2017."
« La catastrophe de Valence montre à quel point la métropole durable reste un oxymore »,https://img.lemde.fr/2024/11/21/0/0/6028/4018/110/73/60/0/a2fd992_1732170181400-flood-in-valencia-75.jpg,"Après les inondations dévastatrices qui ont frappé la ville espagnole, Albert Levy, architecte et urbaniste, constate, dans une tribune au « Monde », que la ville durable reste un projet empêché par le phénomène de métropolisation."
"« Disclose » : Ariane Lavrilleux, la journaliste visée par une enquête sur des atteintes au secret-défense, convoquée par une juge",https://img.lemde.fr/2024/12/03/0/0/6000/4000/110/73/60/0/55213e3_5414880-01-06.jpg,"Dans le cadre de l’instruction ouverte pour compromission du secret de la défense nationale et révélation d’informations permettant de découvrir l’identité d’agents de renseignement, la journaliste avait été placée en garde à vue en septembre 2023."
La dette des pays pauvres atteint un record,https://img.lemde.fr/2024/12/03/0/194/4200/2800/110/73/60/0/76e07b3_1733242477817-000-e6796.jpg,"Le niveau des intérêts payés par les nations les plus démunies à leurs créanciers privés a bondi depuis la pandémie de Covid-19, déplore la Banque mondiale."
"Les cryptomonnaies, un investissement générationnel",https://img.lemde.fr/2023/04/17/0/0/3000/2000/110/73/60/0/b5d1e40_1681718664793-tyu.jpg,"Près d’un quart des 18 à 27 ans auraient déjà acquis des cryptoactifs, attirés par la spéculation comme par la technologie."
Le Sénat veut pousser le gouvernement à faire travailler davantage les salariés pour financer les politiques du grand âge,https://img.lemde.fr/2024/11/18/1/0/3540/2360/110/73/60/0/4b14d16_1731919764507-kersalic-036-1.jpg,"Le Sénat s’apprête à voter une « contribution » de sept heures de travail supplémentaires non payées chaque année afin de répondre « à l’enjeu de l’autonomie et du vieillissement », selon Gérard Larcher, qui espère convaincre le gouvernement de soutenir la mesure."
La vente des Hospices de Beaune sous la contrainte d’un millésime peu abondant,https://img.lemde.fr/2024/11/18/0/0/5796/3864/110/73/60/0/d994f1d_1731911458497-000-36mp9r2.jpg,"Les recettes de cette adjudication, qui viendront financer la modernisation des établissements hospitaliers, se sont établies à 13,9 millions d’euros, bien en deçà des deux éditions précédentes."
Vers quelle épargne se tournent les jeunes ?,https://img.lemde.fr/2023/04/17/0/0/3000/2000/110/73/60/0/587d710_1681719505161-argent-04.jpg,"Les moins de 35 ans optent pour les ETF, les SCPI et même les plans d’épargne-retraite, attirés par la performance financière et les avantages fiscaux."
Quand un don est taxé trois décennies plus tard,https://img.lemde.fr/2023/05/03/0/0/3000/2000/110/73/60/0/d01e012_1683120111391-lmargent9.jpg,"Un tribunal juge que « Le Concert », de Gerrit van Honthorst, a fait l’objet d’un don manuel, dont la révélation, même forcée, doit générer une taxation."
Immobilier : la SCI peut-elle loger gratuitement un de ses membres ?,https://img.lemde.fr/2023/04/17/0/0/3000/2000/110/73/60/0/684b60d_1681721627375-a-ei-ci-ai.jpg,"Une société civile immobilière peut, dans certains cas, mettre un bien à disposition d’un associé gratuitement, mais cela requiert des précautions, note Marie-Laure Decobert, ingénieure patrimoniale chez Swiss Life Banque privée."
Un squelette géant de dinosaure vendu 6 millions d’euros dans les Yvelines,https://img.lemde.fr/2024/11/14/0/0/6000/4000/110/73/60/0/3910dc3_5252374-01-06.jpg,"Composé de 75 % à 80 % des os d’origine, l’imposant spécimen est le plus grand dinosaure jamais mis aux enchères."
Bourse : de l’intérêt des fonds de « pricing power »,https://img.lemde.fr/2023/04/17/0/0/3000/2000/110/73/60/0/711be0f_1681718659473-iii.jpg,"Pour les épargnants, il peut être pertinent de s’intéresser à des placements financiers qui misent sur des sociétés cotées capables de relever régulièrement leurs tarifs sans dégrader leurs ventes."
"Wall Street : après l’envolée, l’effet Trump s’estompe",https://img.lemde.fr/2024/11/15/0/0/6783/4522/110/73/60/0/39b19c7_1731700520995-537018.jpg,"Les craintes liées à la future politique de l’administration Trump, confirmées par les premières nominations du nouveau président américain, prennent le dessus sur les marchés financiers, après une semaine d’euphorie."
L’arte povera rattrapé par le marché,https://img.lemde.fr/2024/11/05/197/0/4724/3149/110/73/60/0/98eb7c7_1730822728520-mario-merz-senza-titolo-1982-acrylic-charcoal-ink-shell-and-gauze-laid-on-cardboard-126-x-127-cm-courtesy-tornabuoni-art-1.jpg,"Ce mouvement révolutionnaire, né en Italie à la fin des années 1960, jouit de l’engouement constant des collectionneurs."
Immobilier : le marché à deux vitesses des SCPI,https://img.lemde.fr/2024/11/14/0/103/3100/2067/110/73/60/0/c74eea6_1731579074538-lemonde-16-11-2024-fortu.jpg,"Les sociétés civiles de placement immobilier (SCPI), prisées pour leurs rendements réguliers, traversent une période de turbulences marquée par la dépréciation des parts et des tensions de liquidité. Toutefois, certaines d’entre elles montrent des signes de résilience."
Placements : comment éviter les pièges des produits structurés,https://img.lemde.fr/2024/11/14/113/0/2732/1821/110/73/60/0/6dc7249_1731591019772-image0-12.jpeg,"Ces produits financiers rencontrent un grand succès, mais, face au mouvement de baisse des taux, il convient de bien comprendre leur fonctionnement pour en éviter les pièges."
"Un réseau de fraude à la TVA démantelé en Europe, 520 millions d’euros saisis",https://img.lemde.fr/2024/11/14/0/0/6144/4096/110/73/60/0/c383549_1731588610248-pns-1092155.jpg,"Ce réseau de fraude, impliquant la mafia italienne, a conduit à une quarantaine de mandats d’arrêt. L’enquête a permis d’évaluer à 1,3 milliard d’euros le montant des fausses factures émises."
Assurance-vie : les possibilités de transfert restent toujours limitées,https://img.lemde.fr/2023/05/03/0/0/3000/2000/110/73/60/0/b34a1ed_1683120138608-lmargent132.jpg,"En assurance-vie, les transferts de contrat ne sont autorisés qu’au sein de la même compagnie. Et, même dans ce cadre, les obstacles sont nombreux pour l’épargnant souhaitant se débarrasser d’un vieux produit sans perdre son antériorité fiscale."
Le sens de l’argent | Le rapport des jeunes à l’argent est-il différent de celui de leurs aînés ?,https://img.lemde.fr/2023/04/17/0/0/3000/2000/110/73/60/0/4088c29_1681719505167-argent-05.jpg, 
Assurance-vie : les fonds d’obligations à échéance en voie de disparition,https://img.lemde.fr/2023/04/19/0/0/3000/2000/110/73/60/0/de0bb7e_1681907746451-fgsrsh.jpg,Mis en avant leur bon rapport rendement-risque les fonds obligataires « à échéance » pourraient perdre progressivement de leur attrait.
"Retraite, impôts : les impacts du divorce ou de la séparation",https://img.lemde.fr/2023/04/17/0/0/3000/2000/110/73/60/0/2a2ab28_1681721637938-rgnrgn.jpg,"Le divorce met un terme à l’imposition commune, mais ne fait pas perdre les droits à la pension de réversion."
Un enfant en bas âge qui en frappe grièvement un autre avec un hochet commet-il une infraction pénale ?,https://img.lemde.fr/2023/04/17/0/0/3000/2000/110/73/60/0/2a2ab28_1681721637938-rgnrgn.jpg,"La victime, invalide à 90 %, demande que la solidarité nationale joue, la responsabilité des parents de l’auteur des coups ayant été écartée."
Droits de succession : peut-on payer le fisc en nature ?,https://img.lemde.fr/2023/04/17/0/0/3000/2000/110/73/60/0/072e178_1681718655250-art-01.jpg,"On peut s’acquitter de certains impôts et taxes par dation, en remettant à l’Etat des œuvres d’art, des livres ou encore un terrain boisé, explique Frédéric Douet, professeur de droit fiscal à l’université Rouen Normandie. A certaines conditions."
"Le social, parent pauvre de l’investissement responsable",https://img.lemde.fr/2023/04/17/0/0/3000/2000/110/73/60/0/a89551b_1681721632459-fgfgf-1.jpg,"Dans l’investissement à thématique environnementale, sociale et de gouvernance, les produits « sociaux » représentent une part minuscule. Notamment parce que les critères extra-financiers sociaux sont moins consensuels que ceux sur l’environnement."
La directive européenne mise sur la transparence des rémunérations pour réduire les inégalités femmes-hommes,https://img.lemde.fr/2024/10/09/0/0/5500/3666/110/73/60/0/9936e44_2024-10-09t083212z-1373438019-rc21z9annf1y-rtrmadp-3-ecb-policy.JPG,La directive du 10 mai 2023 s’attaque aux inégalités dès l’embauche. Elle doit entrer en vigueur en France au plus tard le 7 juin 2026.
Est-ce le moment d’effectuer des donations à des enfants ou petits-enfants ?,https://img.lemde.fr/2024/11/07/113/0/2732/1821/110/73/60/0/ac423cc_1730981189116-image0-62.jpeg,Les perspectives d’instabilité fiscale peuvent inciter certains à transmettre une part de leur patrimoine plus tôt que prévu.
Electricité : la menace d’une hausse de la fiscalité à contre-courant,https://img.lemde.fr/2024/10/15/10/0/5752/3834/110/73/60/0/96c27c1_2024-10-15t134733z-1158143186-rc2ykaap49gr-rtrmadp-3-france-energy.JPG,"Si le gouvernement mise grandement sur l’électricité pour se défaire peu à peu des énergies fossiles, il n’envisage pas moins de porter sa taxation à des niveaux sans précédent."
Euronext se veut artisan de l’union des marchés de capitaux,https://img.lemde.fr/2024/11/07/0/0/5751/3834/110/73/60/0/f951b07_1730993494437-000-34lq9yq.jpg,"L’opérateur boursier, présent dans sept pays européens, entend prendre des initiatives pour favoriser l’intégration financière en Europe, sans attendre des décisions politiques de l’Union."
Epargne des enfants mineurs : les règles qui s’appliquent aux parents séparés,https://img.lemde.fr/2023/04/17/44/66/2934/1956/110/73/60/0/619e532_1681721636915-poiuytr.jpg,"Livret A, Livret jeune, assurance-vie… Nombre de supports d’épargne sont accessibles aux moins de 18 ans. Cet argent est administré légalement par les parents, même en cas de divorce. Mais les règles diffèrent selon les produits."
"Philatélie : de rarissimes courriers transportés par ballons montés de la guerre de 1870, aux enchères chez David Feldman",https://img.lemde.fr/2024/10/23/0/43/937/625/110/73/60/0/78d6826_1729666138943-feldman-paire-pra-sidence.jpg,"L’histoire, avec la guerre franco-prussienne de 1870-1871, et la seconde guerre mondiale font partie des temps forts des ventes de timbres de France et de ses ex-colonies organisées les 19 et 20 novembre en Suisse."
Philatélie : six jours exceptionnels de ventes aux enchères en Suisse,https://img.lemde.fr/2024/10/24/0/30/3477/2318/110/73/60/0/c15a586_1729783904056-feldman-apollo.jpg,"David Feldman organise onze sessions, du 18 au 24 novembre, parmi lesquelles la France, ses ex-colonies, l’île Maurice, les Bermudes et la Grande-Bretagne tiennent leur rang, et où les estimations à six chiffres se bousculent."
"L’art, l’autre mémoire que cultivait Simone Veil",https://img.lemde.fr/2024/11/05/200/133/3735/2490/110/73/60/0/46b8bc7_1730819811299-686-sem-veil-001.jpg,"Dès les années 1970, la ministre arpentait les galeries de la rive gauche, tissant des amitiés avec des marchands marqués par la déportation. Le 4 décembre, une partie de cette collection sera mise aux enchères chez Christie’s."
Egalité femmes-hommes : les leçons des pays les plus avancés,https://img.lemde.fr/2024/11/05/2/0/4875/3250/110/73/60/0/797f6cf_1730804386146-000-33ar4dt.jpg,"Le rapport « Egalité salariale. 7 mesures qui fonctionnent vraiment », publié le 7 novembre par Les Glorieuses, décrit des dynamiques qui ont prouvé leur efficacité dans le monde."
"Assurance-vie : les fonds structurés, une bonne option pour réduire le risque ?",https://img.lemde.fr/2023/04/17/0/0/3000/2000/110/73/60/0/2a2ab28_1681721637938-rgnrgn.jpg,La baisse des taux qui se confirme devrait pousser les concepteurs des fonds structurés à revoir la formule de ces combinaisons promues avec succès dans le cadre de l’assurance-vie.
"Le pacte Dutreil, une niche fiscale pour ultrariches ?",https://img.lemde.fr/2023/04/17/0/0/3000/2000/110/73/60/0/86f462e_1681719505156-argent-01.jpg,"Ce dispositif, qui permet aux héritiers d’une entreprise de bénéficier d’une exonération partielle des droits de succession, est remis en question."
« Les parents de milieu populaire ont davantage besoin d’aide que de leçons »,https://img.lemde.fr/2024/02/10/0/0/3543/2362/110/73/60/0/fec37c3_1707550980991-nanterre-gratacap-090224-16.jpeg,"Les familles issues des quartiers prioritaires, plus exposées à la précarité, se soucient de l’avenir de leurs enfants mais peinent à se faire accompagner. Un collectif rassemblant des représentants d’associations et des chercheuses appelle à repenser avec davantage d’ambition les politiques de soutien à la parentalité, dans une tribune au « Monde »."
"Au Nigeria, à bord du RER de Lagos, un luxe rare en Afrique subsaharienne",https://img.lemde.fr/2024/11/20/0/198/4971/3314/110/73/60/0/a923b48_1732099778916-rea10633556.jpg,"La capitale économique nigériane, tentaculaire, a inauguré, il y a un an, son premier train urbain. Aérien, ponctuel et abordable, il constitue une révolution pour les habitants et illustre l’émergence de transports en commun modernes sur le continent africain."
Paris : un plan climat 2024-2030 pour « accélérer » la transformation de la capitale,https://img.lemde.fr/2024/11/20/333/0/5000/3333/110/73/60/0/ba3dcb2_1732121050222-kzihnioglu-paris-conseil-de-paris-19112024-09.JPG,"Adopté en Conseil de Paris, mercredi 20 novembre, ce plan se décline en 500 actions visant à faire de la capitale une ville « plus verte, plus respirable et plus résiliente ». Les oppositions dénoncent le manque de cohérence et l’idéologie de l’équipe en place."
"A Paris, surélever les immeubles pour produire plus de logements",https://img.lemde.fr/2024/11/20/600/0/5000/3333/110/73/60/0/ef73adf_1732091328778-kzihnioglu-paris-conseil-de-paris-19112024-24.JPG,"Le nouveau plan d’urbanisme parisien donne la priorité à la création d’espaces verts. Alors, pour permettre à plus de personnes de se loger dans la capitale, reste une solution encouragée par les nouvelles règles de construction : ajouter des étages."
"A Paris, le grand chamboulement des règles de construction",https://img.lemde.fr/2024/11/19/168/0/4032/2688/110/73/60/0/49c7cef_1732029895869-img-4385.JPG,"Le nouveau plan local d’urbanisme dit « bioclimatique » de la capitale doit être définitivement approuvé mercredi 20 novembre. Il crée de nouvelles obligations pour les promoteurs et investisseurs : végétalisation, amélioration du quartier, création de logements accessibles…"
"L’ex-maire de Saint-Pierre-des-Corps, « soulagé » d’avoir démissionné : « C’était dur, éprouvant et tellement frustrant »",https://img.lemde.fr/2024/11/20/0/0/7555/5036/110/73/60/0/b2c090d_1732092652600-sipa-01184866-000005.jpg,"En juillet, Emmanuel François a annoncé quitter son poste, près de deux ans avant la fin de son mandat. Un exemple, parmi d’autres, de la vague actuelle de démissions d’édiles."
"Martial Foucault, politiste : « Les maires disent souffrir d’un manque de reconnaissance de la part de l’Etat »",https://img.lemde.fr/2024/11/19/0/0/6000/4000/110/73/60/0/c073cb6_1732033612174-000-36mv7j6.jpg,"Le professeur à Sciences Po Paris explique, dans un entretien au « Monde », les raisons qui poussent les édiles à mettre fin à leur mandat."
"Avec la hausse des démissions de maires, la crainte d’un « crash démocratique »",https://img.lemde.fr/2024/11/19/177/110/2000/1333/110/73/60/0/a2ddc7c_1732057554962-image0.jpeg,"Alors que le congrès de l’Association des maires de France se tient à Paris du 19 au 21 novembre, la hausse du nombre d’édiles raccrochant l’écharpe fait redouter une pénurie de candidats aux élections municipales de 2026."
"A Bordeaux, un atelier pour sensibiliser aux risques des soirées étudiantes sans avoir l’air rabat-joie",https://img.lemde.fr/2024/11/18/0/0/6240/4160/110/73/60/0/054ecc5_1731943780023-miage.jpg,"L’Espace santé étudiants de l’université de la ville girondine distille des conseils aux responsables associatifs en charge de l’organisation des événements festifs, où l’alcool coule à flots et est responsable de plus de la moitié des violences sexuelles et sexistes."
"Dans un congrès marqué par la colère, les maires instaurent un rapport de force contre Michel Barnier",https://img.lemde.fr/2024/11/22/0/0/6720/4480/110/73/60/0/0a8d228_1732272627856-cbi1227040.jpg,"Les élus entament leur congrès sur la défensive, face aux restrictions budgétaires demandées aux collectivités en 2025. Le président du Sénat, Gérard Larcher, demande quant à lui que l’effort budgétaire soit ramené à 2 milliards d’euros, au lieu de 5 milliards."
"Conseil de Paris : derrière les grands plans stratégiques, l’épineuse question du financement",https://img.lemde.fr/2024/10/24/0/0/6000/4000/110/73/60/0/49cd3fa_b68b01e6caca4dd4a5cf2adc5e0014e0-0-1af05a9cef1c4bc881dfb350cb4e1e82.jpg,"Les oppositions de droite et du centre dénoncent l’« impasse budgétaire » de la capitale, qui se défausserait sur l’Etat et la crise du marché immobilier pour justifier ses difficultés de financement."
"Pour Anne Hidalgo, un Conseil de Paris aux allures de bilan de fin de mandat",https://img.lemde.fr/2024/11/19/0/0/4885/3257/110/73/60/0/4b82a24_1732001971064-000-36jd2jq.jpg,"Quatre grands dossiers stratégiques sont à l’ordre du jour du Conseil de Paris qui démarre mardi : le plan climat, le plan local d’urbanisme bioclimatique, le plan de santé environnementale et la stratégie de résilience de la Ville."
"Emmanuel Grégoire, ancien premier adjoint d’Anne Hidalgo, est candidat à la Mairie de Paris",https://img.lemde.fr/2023/09/28/1/0/7735/5156/110/73/60/0/6663442_1695914386057-000-32lq2nr.jpg,"Le député, âgé de 46 ans, est en froid avec l’actuelle édile de la capitale."
"Drogues : à Paris, les usagers de crack n’ont pas disparu avec les Jeux olympiques",https://img.lemde.fr/2024/11/18/1/0/5000/3333/110/73/60/0/8ce94ed_1731950429953-maxnewsspecialtwo051762.jpg,"Si aucune « scène ouverte » d’ampleur ne s’est reconstituée, les consommateurs de crack sont toujours présents, notamment dans le nord-est de la capitale."
"Au procès de la rue d’Aubagne, les témoignages poignants des proches de victimes",https://img.lemde.fr/2024/11/18/0/0/7975/5316/110/73/60/0/40bf7cb_1731963580970-000-36lh4ac.jpg,Le tribunal de Marseille avait réservé six jours pour évoquer les parcours de vie des huit victimes et entendre un grand nombre des quelque 90 parties civiles.
